[
  {
    "id": "aggression-begets-aggression-questor-forgepact",
    "name": "AGGRESSION BEGETS AGGRESSION",
    "category": "detachment",
    "type": "strategic-ploy",
    "detachment_id": "questor-forgepact",
    "cp_cost": 1,
    "phases": [
      "shooting"
    ],
    "player_turn": "your-turn",
    "timing": "once-per-phase",
    "target_restrictions": null,
    "ability_id": null,
    "game_version": {
      "edition": "11th",
      "dataslate": "pre-launch-provisional"
    }
  },
  {
    "id": "bonded-imperative-questor-forgepact",
    "name": "BONDED IMPERATIVE",
    "category": "detachment",
    "type": "epic-deed",
    "detachment_id": "questor-forgepact",
    "cp_cost": 1,
    "phases": [
      "command"
    ],
    "player_turn": "your-turn",
    "timing": "once-per-phase",
    "target_restrictions": null,
    "ability_id": null,
    "game_version": {
      "edition": "11th",
      "dataslate": "pre-launch-provisional"
    }
  },
  {
    "id": "courageous-stand-questoris-companions",
    "name": "COURAGEOUS STAND",
    "category": "detachment",
    "type": "epic-deed",
    "detachment_id": "questoris-companions",
    "cp_cost": 1,
    "phases": [
      "fight",
      "shooting"
    ],
    "player_turn": "either",
    "timing": "once-per-phase",
    "target_restrictions": null,
    "ability_id": null,
    "game_version": {
      "edition": "11th",
      "dataslate": "pre-launch-provisional"
    },
    "external_refs": [
      {
        "namespace": "game-datacards",
        "id": "39d423ce-a665-5cce-8b46-d0f38af84fd3"
      },
      {
        "namespace": "mfm",
        "id": "2144578e-ef9a-4a05-b8fe-60b1e114b511"
      }
    ]
  },
  {
    "id": "drive-them-out-gate-warden-lance",
    "name": "DRIVE THEM OUT!",
    "category": "detachment",
    "type": "battle-tactic",
    "detachment_id": "gate-warden-lance",
    "cp_cost": 1,
    "phases": [
      "fight",
      "shooting"
    ],
    "player_turn": "either",
    "timing": "once-per-phase",
    "target_restrictions": null,
    "ability_id": null,
    "game_version": {
      "edition": "11th",
      "dataslate": "pre-launch-provisional"
    },
    "external_refs": [
      {
        "namespace": "game-datacards",
        "id": "f50743a0-e49a-548f-ab85-60d406e34845"
      },
      {
        "namespace": "mfm",
        "id": "9fb1878e-0555-44db-891e-a1a761fa1225"
      }
    ]
  },
  {
    "id": "driven-by-the-past-questoris-companions",
    "name": "DRIVEN BY THE PAST",
    "category": "detachment",
    "type": "epic-deed",
    "detachment_id": "questoris-companions",
    "cp_cost": 1,
    "phases": [
      "charge"
    ],
    "player_turn": "your-turn",
    "timing": "once-per-phase",
    "target_restrictions": null,
    "ability_id": null,
    "game_version": {
      "edition": "11th",
      "dataslate": "pre-launch-provisional"
    },
    "external_refs": [
      {
        "namespace": "game-datacards",
        "id": "315fdeed-7f62-5d25-879f-68334a1d43b2"
      },
      {
        "namespace": "mfm",
        "id": "ad2b79e6-2dc5-42d4-ab28-4daa01efc384"
      }
    ]
  },
  {
    "id": "exemplars-wisdom-spearhead-at-arms",
    "name": "EXEMPLAR’S WISDOM",
    "category": "detachment",
    "type": "battle-tactic",
    "detachment_id": "spearhead-at-arms",
    "cp_cost": 1,
    "phases": [
      "shooting"
    ],
    "player_turn": "your-turn",
    "timing": "once-per-phase",
    "target_restrictions": null,
    "ability_id": null,
    "game_version": {
      "edition": "11th",
      "dataslate": "pre-launch-provisional"
    },
    "external_refs": [
      {
        "namespace": "game-datacards",
        "id": "7d9063a3-f31f-520f-892c-44e80edb6280"
      },
      {
        "namespace": "mfm",
        "id": "8d4a096d-8753-4149-833d-339072d21ac9"
      }
    ]
  },
  {
    "id": "fire-shocked-dominus-foebreakers",
    "name": "FIRE SHOCKED",
    "category": "detachment",
    "detachment_id": "dominus-foebreakers",
    "cp_cost": 1,
    "phases": [
      "shooting"
    ],
    "player_turn": "your-turn",
    "timing": "once-per-phase",
    "target_restrictions": null,
    "ability_id": "fire-shocked-dominus-foebreakers",
    "game_version": {
      "edition": "11th",
      "dataslate": "pre-launch-provisional"
    },
    "external_refs": [
      {
        "namespace": "game-datacards",
        "id": "4f3d1ee8-4c49-541f-a91d-9b6c6d7d219a"
      },
      {
        "namespace": "mfm",
        "id": "e536d54c-5ea4-4e09-8168-97e31c06a389"
      }
    ]
  },
  {
    "id": "flanking-manoeuvres-freeblade-company",
    "name": "FLANKING MANOEUVRES",
    "category": "detachment",
    "type": "strategic-ploy",
    "detachment_id": "freeblade-company",
    "cp_cost": 1,
    "phases": [
      "fight"
    ],
    "player_turn": "opponent-turn",
    "timing": "once-per-phase",
    "target_restrictions": null,
    "ability_id": "flanking-manoeuvres-freeblade-company",
    "game_version": {
      "edition": "11th",
      "dataslate": "pre-launch-provisional"
    },
    "external_refs": [
      {
        "namespace": "game-datacards",
        "id": "0f3693be-81cf-545b-9a95-f27e80a8eab2"
      },
      {
        "namespace": "mfm",
        "id": "3368d993-1555-4279-af2a-a0a9cfee379a"
      }
    ]
  },
  {
    "id": "foebreaker-firestorm-dominus-foebreakers",
    "name": "FOEBREAKER FIRESTORM",
    "category": "detachment",
    "detachment_id": "dominus-foebreakers",
    "cp_cost": 1,
    "phases": [
      "shooting"
    ],
    "player_turn": "your-turn",
    "timing": "once-per-phase",
    "target_restrictions": null,
    "ability_id": "foebreaker-firestorm-dominus-foebreakers",
    "game_version": {
      "edition": "11th",
      "dataslate": "pre-launch-provisional"
    },
    "external_refs": [
      {
        "namespace": "game-datacards",
        "id": "d2dfdd36-bbed-5a7a-8de3-903242afaf8e"
      },
      {
        "namespace": "mfm",
        "id": "9e203a34-7bd6-4faa-966a-a5380a7bad91"
      }
    ]
  },
  {
    "id": "fortress-of-intimidation-gate-warden-lance",
    "name": "FORTRESS OF INTIMIDATION",
    "category": "detachment",
    "type": "epic-deed",
    "detachment_id": "gate-warden-lance",
    "cp_cost": 1,
    "phases": [
      "charge"
    ],
    "player_turn": "opponent-turn",
    "timing": "once-per-phase",
    "target_restrictions": null,
    "ability_id": null,
    "game_version": {
      "edition": "11th",
      "dataslate": "pre-launch-provisional"
    },
    "external_refs": [
      {
        "namespace": "game-datacards",
        "id": "f5dbd509-f0f5-5940-9310-040de263ff5d"
      },
      {
        "namespace": "mfm",
        "id": "4e398d25-5ed1-46e5-9d48-586ae2739c0d"
      }
    ]
  },
  {
    "id": "full-tilt-freeblade-company",
    "name": "FULL TILT",
    "category": "detachment",
    "type": "wargear",
    "detachment_id": "freeblade-company",
    "cp_cost": 1,
    "phases": [
      "movement"
    ],
    "player_turn": "your-turn",
    "timing": "once-per-phase",
    "target_restrictions": null,
    "ability_id": "full-tilt-freeblade-company",
    "game_version": {
      "edition": "11th",
      "dataslate": "pre-launch-provisional"
    },
    "external_refs": [
      {
        "namespace": "game-datacards",
        "id": "467ee003-3791-5f57-ac58-c4d682543cbe"
      },
      {
        "namespace": "mfm",
        "id": "752b879c-a9ec-43a4-ac22-7cf12eb041db"
      }
    ]
  },
  {
    "id": "full-tilt-valourstrike-lance",
    "name": "FULL TILT",
    "category": "detachment",
    "type": "battle-tactic",
    "detachment_id": "valourstrike-lance",
    "cp_cost": 2,
    "phases": [
      "movement"
    ],
    "player_turn": "your-turn",
    "timing": "once-per-phase",
    "target_restrictions": null,
    "ability_id": null,
    "game_version": {
      "edition": "11th",
      "dataslate": "pre-launch-provisional"
    },
    "external_refs": [
      {
        "namespace": "game-datacards",
        "id": "3caa71b2-1789-5db2-b62f-f5c4af1cfab4"
      },
      {
        "namespace": "mfm",
        "id": "3f80ee20-b7bc-446b-be65-f81e6acd1385"
      }
    ]
  },
  {
    "id": "ground-shaking-strides-dominus-foebreakers",
    "name": "GROUND-SHAKING STRIDES",
    "category": "detachment",
    "detachment_id": "dominus-foebreakers",
    "cp_cost": 1,
    "phases": [
      "movement"
    ],
    "player_turn": "your-turn",
    "timing": "once-per-phase",
    "target_restrictions": null,
    "ability_id": "ground-shaking-strides-dominus-foebreakers",
    "game_version": {
      "edition": "11th",
      "dataslate": "pre-launch-provisional"
    },
    "external_refs": [
      {
        "namespace": "game-datacards",
        "id": "10071fbf-6f85-53f4-98aa-ea6f31eab075"
      },
      {
        "namespace": "mfm",
        "id": "65caee89-44d0-49a2-81b0-33e12539c898"
      }
    ]
  },
  {
    "id": "helm-conditioning-throne-bonded-outriders",
    "name": "HELM CONDITIONING",
    "category": "detachment",
    "detachment_id": "throne-bonded-outriders",
    "cp_cost": 1,
    "phases": [
      "command"
    ],
    "player_turn": "your-turn",
    "timing": "once-per-phase",
    "target_restrictions": null,
    "ability_id": "helm-conditioning-throne-bonded-outriders",
    "game_version": {
      "edition": "11th",
      "dataslate": "pre-launch-provisional"
    },
    "external_refs": [
      {
        "namespace": "game-datacards",
        "id": "a89cd102-47b4-5153-917e-b5d78be4a821"
      },
      {
        "namespace": "mfm",
        "id": "bdd19e76-fd4e-490d-8d7f-c78ad042face"
      }
    ]
  },
  {
    "id": "heros-tread-questoris-companions",
    "name": "HERO’S TREAD",
    "category": "detachment",
    "type": "epic-deed",
    "detachment_id": "questoris-companions",
    "cp_cost": 1,
    "phases": [
      "command"
    ],
    "player_turn": "your-turn",
    "timing": "once-per-phase",
    "target_restrictions": null,
    "ability_id": null,
    "game_version": {
      "edition": "11th",
      "dataslate": "pre-launch-provisional"
    },